{
  "id": "ejec-sesion-demo-001-20260815-144427",
  "schema_version": 1,
  "sesion_id": "sesion-demo-001",
  "publicacion_ejecutada": 1,
  "publicacion_hash": "sha256:a5fef354bf65618753fbd8c743f9cbec201df43d5ea4d9fe840f941870407d2b",
  "check_in": {
    "solicitado": false,
    "motivo": "H1 no implementa check-in. No se solicito ninguno para esta sesion, de modo que no hay respuesta que registrar (D-020)."
  },
  "inicio": {
    "registrado": false,
    "motivo": "Esta vista no observa el inicio real de la sesion. Registrar la hora en que se abrio la pagina seria presentar una inferencia como un hecho."
  },
  "fin": {
    "registrado": false,
    "motivo": "Esta vista no observa el fin real de la sesion. La hora en que se copio el registro se guarda aparte, en generado_en."
  },
  "series": [
    {
      "ejercicio_id": "s1-a",
      "ejercicio_nombre": "Prensa de piernas",
      "serie": 1,
      "realizada": true,
      "programado": [
        {
          "campo": "carga",
          "etiqueta": "Carga",
          "prescrito": false,
          "motivo_no_prescrito": "la elige el alumno para alcanzar el RIR objetivo"
        },
        {
          "campo": "reps",
          "etiqueta": "Reps",
          "prescrito": true,
          "valor": "8"
        },
        {
          "campo": "rir",
          "etiqueta": "RIR real",
          "prescrito": true,
          "valor": "2–3"
        }
      ],
      "ejecutado": {
        "registrado": true,
        "campos": {
          "carga": "120",
          "reps": "8",
          "rir": "2"
        },
        "campos_sin_registrar": []
      },
      "motivo_diferencia": {
        "registrado": false,
        "motivo": "Esta vista no captura un motivo por serie."
      }
    },
    {
      "ejercicio_id": "s1-a",
      "ejercicio_nombre": "Prensa de piernas",
      "serie": 2,
      "realizada": true,
      "programado": [
        {
          "campo": "carga",
          "etiqueta": "Carga",
          "prescrito": false,
          "motivo_no_prescrito": "la elige el alumno para alcanzar el RIR objetivo"
        },
        {
          "campo": "reps",
          "etiqueta": "Reps",
          "prescrito": true,
          "valor": "8"
        },
        {
          "campo": "rir",
          "etiqueta": "RIR real",
          "prescrito": true,
          "valor": "2–3"
        }
      ],
      "ejecutado": {
        "registrado": true,
        "campos": {
          "carga": "120",
          "reps": "6"
        },
        "campos_sin_registrar": [
          "rir"
        ]
      },
      "motivo_diferencia": {
        "registrado": false,
        "motivo": "Esta vista no captura un motivo por serie."
      }
    },
    {
      "ejercicio_id": "s1-a",
      "ejercicio_nombre": "Prensa de piernas",
      "serie": 3,
      "realizada": false,
      "programado": [
        {
          "campo": "carga",
          "etiqueta": "Carga",
          "prescrito": false,
          "motivo_no_prescrito": "la elige el alumno para alcanzar el RIR objetivo"
        },
        {
          "campo": "reps",
          "etiqueta": "Reps",
          "prescrito": true,
          "valor": "8"
        },
        {
          "campo": "rir",
          "etiqueta": "RIR real",
          "prescrito": true,
          "valor": "2–3"
        }
      ],
      "ejecutado": {
        "registrado": false,
        "motivo": "La serie no se marco como realizada y no se registro ningun valor."
      },
      "motivo_diferencia": {
        "registrado": false,
        "motivo": "Esta vista no captura un motivo por serie."
      }
    },
    {
      "ejercicio_id": "s1-b",
      "ejercicio_nombre": "Zancada hacia atras con mancuernas",
      "serie": 1,
      "realizada": true,
      "programado": [
        {
          "campo": "carga",
          "etiqueta": "Carga",
          "prescrito": false,
          "motivo_no_prescrito": "la elige el alumno para alcanzar el RIR objetivo"
        },
        {
          "campo": "reps",
          "etiqueta": "Reps",
          "prescrito": true,
          "valor": "8/lado"
        },
        {
          "campo": "rir",
          "etiqueta": "RIR real",
          "prescrito": true,
          "valor": "3"
        }
      ],
      "ejecutado": {
        "registrado": false,
        "motivo": "La serie se marco como realizada pero no se registro ningun valor."
      },
      "motivo_diferencia": {
        "registrado": false,
        "motivo": "Esta vista no captura un motivo por serie."
      }
    },
    {
      "ejercicio_id": "s1-b",
      "ejercicio_nombre": "Zancada hacia atras con mancuernas",
      "serie": 2,
      "realizada": false,
      "programado": [
        {
          "campo": "carga",
          "etiqueta": "Carga",
          "prescrito": false,
          "motivo_no_prescrito": "la elige el alumno para alcanzar el RIR objetivo"
        },
        {
          "campo": "reps",
          "etiqueta": "Reps",
          "prescrito": true,
          "valor": "8/lado"
        },
        {
          "campo": "rir",
          "etiqueta": "RIR real",
          "prescrito": true,
          "valor": "3"
        }
      ],
      "ejecutado": {
        "registrado": false,
        "motivo": "La serie no se marco como realizada y no se registro ningun valor."
      },
      "motivo_diferencia": {
        "registrado": false,
        "motivo": "Esta vista no captura un motivo por serie."
      }
    },
    {
      "ejercicio_id": "s1-c",
      "ejercicio_nombre": "Press banca con mancuernas",
      "serie": 1,
      "realizada": false,
      "programado": [
        {
          "campo": "carga",
          "etiqueta": "Carga",
          "prescrito": false,
          "motivo_no_prescrito": "la elige el alumno para alcanzar el RIR objetivo"
        },
        {
          "campo": "reps",
          "etiqueta": "Reps",
          "prescrito": true,
          "valor": "8"
        },
        {
          "campo": "rir",
          "etiqueta": "RIR real",
          "prescrito": true,
          "valor": "2–3"
        }
      ],
      "ejecutado": {
        "registrado": false,
        "motivo": "La serie no se marco como realizada y no se registro ningun valor."
      },
      "motivo_diferencia": {
        "registrado": false,
        "motivo": "Esta vista no captura un motivo por serie."
      }
    },
    {
      "ejercicio_id": "s1-c",
      "ejercicio_nombre": "Press banca con mancuernas",
      "serie": 2,
      "realizada": false,
      "programado": [
        {
          "campo": "carga",
          "etiqueta": "Carga",
          "prescrito": false,
          "motivo_no_prescrito": "la elige el alumno para alcanzar el RIR objetivo"
        },
        {
          "campo": "reps",
          "etiqueta": "Reps",
          "prescrito": true,
          "valor": "8"
        },
        {
          "campo": "rir",
          "etiqueta": "RIR real",
          "prescrito": true,
          "valor": "2–3"
        }
      ],
      "ejecutado": {
        "registrado": false,
        "motivo": "La serie no se marco como realizada y no se registro ningun valor."
      },
      "motivo_diferencia": {
        "registrado": false,
        "motivo": "Esta vista no captura un motivo por serie."
      }
    },
    {
      "ejercicio_id": "s1-c",
      "ejercicio_nombre": "Press banca con mancuernas",
      "serie": 3,
      "realizada": false,
      "programado": [
        {
          "campo": "carga",
          "etiqueta": "Carga",
          "prescrito": false,
          "motivo_no_prescrito": "la elige el alumno para alcanzar el RIR objetivo"
        },
        {
          "campo": "reps",
          "etiqueta": "Reps",
          "prescrito": true,
          "valor": "8"
        },
        {
          "campo": "rir",
          "etiqueta": "RIR real",
          "prescrito": true,
          "valor": "2–3"
        }
      ],
      "ejecutado": {
        "registrado": false,
        "motivo": "La serie no se marco como realizada y no se registro ningun valor."
      },
      "motivo_diferencia": {
        "registrado": false,
        "motivo": "Esta vista no captura un motivo por serie."
      }
    },
    {
      "ejercicio_id": "s1-d",
      "ejercicio_nombre": "Jalon al pecho",
      "serie": 1,
      "realizada": false,
      "programado": [
        {
          "campo": "carga",
          "etiqueta": "Carga",
          "prescrito": false,
          "motivo_no_prescrito": "la elige el alumno para alcanzar el RIR objetivo"
        },
        {
          "campo": "reps",
          "etiqueta": "Reps",
          "prescrito": true,
          "valor": "10"
        },
        {
          "campo": "rir",
          "etiqueta": "RIR real",
          "prescrito": true,
          "valor": "2–3"
        }
      ],
      "ejecutado": {
        "registrado": false,
        "motivo": "La serie no se marco como realizada y no se registro ningun valor."
      },
      "motivo_diferencia": {
        "registrado": false,
        "motivo": "Esta vista no captura un motivo por serie."
      }
    },
    {
      "ejercicio_id": "s1-d",
      "ejercicio_nombre": "Jalon al pecho",
      "serie": 2,
      "realizada": false,
      "programado": [
        {
          "campo": "carga",
          "etiqueta": "Carga",
          "prescrito": false,
          "motivo_no_prescrito": "la elige el alumno para alcanzar el RIR objetivo"
        },
        {
          "campo": "reps",
          "etiqueta": "Reps",
          "prescrito": true,
          "valor": "10"
        },
        {
          "campo": "rir",
          "etiqueta": "RIR real",
          "prescrito": true,
          "valor": "2–3"
        }
      ],
      "ejecutado": {
        "registrado": false,
        "motivo": "La serie no se marco como realizada y no se registro ningun valor."
      },
      "motivo_diferencia": {
        "registrado": false,
        "motivo": "Esta vista no captura un motivo por serie."
      }
    },
    {
      "ejercicio_id": "s1-d",